{
  "id": "cell-rooftop",
  "type": "marble",
  "description": "Rooftop cell at night (goal.md AD-2): neon, the bay skyline, the fan. Marble text prompt (+ key art once approved) → spz 100k/500k/full + collider + pano + cell.json.",
  "inputs": {
    "images": [],
    "text": "Standing on a flat tar-and-gravel rooftop at night in the Bay Area. A low parapet wall, HVAC units, a rooftop water tank, satellite dishes, a rooftop party corner with folding chairs, a cooler and string lights; a large neon sign on the neighboring building throws pink and cyan light across the roof; beyond the parapet the bay, the city skyline and distant bridge lights glow through a fog bank. Photorealistic, physically plausible night light with neon reflections on wet gravel, melancholy and beautiful. No people, no cars."
  },
  "params": {
    "model": "marble-1.1",
    "cellId": "rooftop",
    "displayName": "Rooftop",
    "lighting": { "preset": "night", "envmapFromPano": true }
  },
  "outputs": [
    { "name": "rooftop.100k.spz", "kind": "spz" },
    { "name": "rooftop.500k.spz", "kind": "spz" },
    { "name": "rooftop.full.spz", "kind": "spz" },
    { "name": "rooftop.collider.glb", "kind": "glb" },
    { "name": "rooftop.pano.jpg", "kind": "jpg" },
    { "name": "cell.json", "kind": "json" }
  ],
  "budgetUsd": 1.3,
  "parallelSafe": true
}
