{
  "id": "cell-lookout",
  "type": "marble",
  "description": "Hills lookout cell at fog-noon (goal.md AD-2): the whole block below, a natural Producer vantage. Marble text prompt (+ key art once approved) → spz 100k/500k/full + collider + pano + cell.json.",
  "inputs": {
    "images": [],
    "text": "Standing at a hillside lookout above a Bay Area neighborhood at foggy noon. A gravel turnout with a low wooden fence and a coin-operated viewer, eucalyptus trees and dry golden grass, a winding road dropping down the hill, the whole block of houses and the coastline below dissolving into thick fog, soft diffuse overcast light, muted colors, damp asphalt, a weathered bench. Photorealistic, physically plausible light, quiet and wistful. No people, no cars."
  },
  "params": {
    "model": "marble-1.1",
    "cellId": "lookout",
    "displayName": "Hills lookout",
    "lighting": { "preset": "fog_noon", "envmapFromPano": true }
  },
  "outputs": [
    { "name": "lookout.100k.spz", "kind": "spz" },
    { "name": "lookout.500k.spz", "kind": "spz" },
    { "name": "lookout.full.spz", "kind": "spz" },
    { "name": "lookout.collider.glb", "kind": "glb" },
    { "name": "lookout.pano.jpg", "kind": "jpg" },
    { "name": "cell.json", "kind": "json" }
  ],
  "budgetUsd": 1.3,
  "parallelSafe": true
}
