{
  "id": "cell-alley",
  "type": "marble",
  "description": "Corner store + mural alley cell at blue hour (goal.md AD-2): tagging wall (SDF paint), the OG, the taco truck spot. Marble text prompt (+ key art once approved) → spz 100k/500k/full + collider + pano + cell.json.",
  "inputs": {
    "images": [],
    "text": "Standing at the mouth of a mural alley beside a corner store in a Bay Area neighborhood at blue hour. On the corner a small bodega with a lit awning, hand-painted signage and a neon OPEN sign; along the alley a long brick wall with a half-finished mural and layers of old tags, dumpsters, a fire escape, a chain-link fence, an empty curbside spot under a string of bulbs, wet asphalt reflecting sodium-orange streetlights against a deep blue sky, light fog. Photorealistic, physically plausible light, wistful melancholy-beautiful West Coast dusk. No people, no cars."
  },
  "params": {
    "model": "marble-1.1",
    "cellId": "alley",
    "displayName": "Corner store & mural alley",
    "lighting": { "preset": "blue", "envmapFromPano": true }
  },
  "outputs": [
    { "name": "alley.100k.spz", "kind": "spz" },
    { "name": "alley.500k.spz", "kind": "spz" },
    { "name": "alley.full.spz", "kind": "spz" },
    { "name": "alley.collider.glb", "kind": "glb" },
    { "name": "alley.pano.jpg", "kind": "jpg" },
    { "name": "cell.json", "kind": "json" }
  ],
  "budgetUsd": 1.3,
  "parallelSafe": true
}
